{"bounded_next_actions":["owner validates binding sources"],"dependency_nodes":[{"node":"face-master","purpose":"identity anchor"}],"edges":[{"from":"face-master","to":"expression-sheet"}],"findings":[],"production_job_constraints":[{"subject_count":1,"view_count":1}],"profile_id":"cinematic_live_action","reference_bindings":[{"forbid":["wardrobe"],"inherit":["face_geometry"],"role":"identity_source"}],"scene_binding_requirements":[{"needs":["location"],"scene":"fixture-scene"}],"stage_gates":[{"qc":"motion audition","stage":"face-master"}],"uncertainty":{"release_dependency":"unavailable"}}